<!ELEMENT BARAJA (ESPAÑOLA, POKER)>
<!ELEMENT ESPAÑOLA (CARTA*)>
<!ELEMENT CARTA (NOMBRE, VALOR, PRIORIDAD)>
<!ATTLIST CARTA carta ID #REQUIRED> 
<!ELEMENT POKER (CARTA*)>
<!ELEMENT NOMBRE (#PCDATA)>
<!ELEMENT VALOR (#PCDATA)>
<!ELEMENT PRIORIDAD (#PCDATA)>
